{"format":"storyboard","id":"c2-2026-w41-2","channel":"c2-reach","theme":"offset","film":"c2-2026-w41-2","brief":{"story_core":"The same sealed pocket of air was useless on a wall and priceless around a machine: an invention failed twice not because it was bad but because it was hung in the wrong place.","emotion":"Amused pity for two men whose wallpaper cannot even hold a calendar, mild deflation as it fails again in a greenhouse, then a jolt of delight when the same wrap takes a full drop and the computer inside keeps turning; the turn is the drop.","hook":"Frame 0: a close view of a 1957 living-room wall papered in glossy teal domes, a printed 1957 calendar hanging from a nail driven straight through one dome, the dome dimpled and straining around the nail. At 0.15 s the dome pops, the nail tips out and the calendar drops, see-sawing like falling paper, and lands on the floorboards by 1 s while the camera starts to pull back. No title, no big text.","visual_question":"What kind of wall pops, and who papered a room with it?","metaphor":"Bubble wrap as the wrong wallpaper: one sheet of sealed air travels from a wall that cannot hold a nail, through a roller where it is born, past a shop and a greenhouse that reject it, to the one place it belongs, hugging a computer as it falls.","world":"A 1957 magazine illustration printed in two inks on newsprint: flat cut-paper shapes with ink keylines, teal Ben-Day dots for shade, one coral plate slightly out of register; a living room, a workshop roller mangle, a wallpaper display rack, a backyard greenhouse and a loading dock with an IBM tape drive.","camera":"A tracking camera that follows the sheet itself: close on the nail, pull back to the room, push into the flopped strip, tilt down the roller as the sheet comes out, ride the lone roll into the greenhouse, take the torn sheet across the lens to the dock, hold locked for the drop, dive into a single bubble and pull back to the room where it started.","motion":"Gravity and air: paper see-saws as it falls, the strip peels and flops with weight, domes inflate with a small overshoot as they leave the roller, squash on impact and pop in a fast ripple; the two engineers move on twos like printed puppets; one long held silence before the drop.","typography":"DIN Condensed only, printed into the world: the calendar year, figure captions under the two engineers like a magazine plate, price tags struck through in coral, stencil on the machine's crate base, the company name printed on a shipping label; captions are narrow condensed caps on torn newsprint slips.","material":"Theme offset: newsprint paper, teal surface ink for the wallpaper and the sheet, darker teal Ben-Day screens for shadow, near-black ink keylines, coral only for the reveal (1957, the names, Sealed Air); paper grain multiplied over everything.","transitions":"Every change rides the sheet: the flopped strip drapes over the engineers and is pulled off to reveal their workshop; the bubbled sheet runs down out of the roller and lands rolled in a shop rack; the unwanted roll is stretched into a greenhouse; the torn greenhouse sheet blows across the lens and lands wrapped around the computer; a dive into one bubble opens onto the original wall.","sound":"Physical foley only: a pop for every bubble that bursts, paper flutter and a floorboard tap for the calendar, a long cloth flop, roller creaks and soft puffs as domes inflate, swishes as other rolls sell, a pen strike, a tear and wind for the greenhouse, chain clank, one heavy thump and a ripple of pops on the drop; the music cuts out for the beat before the drop.","music":{"caption":"late 1950s lounge exotica, tremolo electric guitar, bongos and shaker, soft Hammond organ chords, upright bass, playful and slightly comic, sparse opening, light cha-cha groove builds, a sudden stop, then a bright full finish, instrumental","bpm":126,"key":"F major","seed":5719},"payoff":"The drop: the wrapped tape drive falls onto the dock in silence, the bottom row of bubbles bursts in a ripple of pops, it bounces, settles and its reels quietly turn; then one bubble opens back onto the 1957 wall, where the engineers are still under their flopped strip.","coords":{"luminance":"mid","temperature":"neutral","rendering":"collage","space":"layered","camera":"tracking","motion":"physical","texture":"halftone","type":"condensed","hook":"physical-interaction","sound":"foley-led"}},"style":"c2-archive-gold-v1","hookPattern":"before-after","scenes":[{"primitive":"word-stack-slam","params":{"text":"A *1957* failure nobody wanted."},"vo":"1957. Two engineers tried wallpaper. It flopped."},{"primitive":"pile-drop","transition":"cut","params":{"item":{"title":"BUBBLE","id":"B-","pill":"WRAP","amount":false},"count":18,"start":1},"vo":"Fielding and Chavannes sealed shower curtains together. Trapped air made bubbles."},{"primitive":"highlighter-swipe","transition":"ink-wipe","params":{"text":"Nobody wanted it until IBM called."},"vo":"Nobody wanted bubbly plastic walls at all. Then greenhouses. That failed too."},{"primitive":"conveyor","transition":"ink-wipe","params":{"item":{"title":"WRAP","id":"B-","pill":"SAFE","amount":false},"node":{"icon":"package","label":"Ship computers","sub":"IBM 1401, safely"},"count":10},"vo":"IBM needed to ship fragile computers safely. Failed wallpaper became perfect armor."},{"primitive":"counter-drop","transition":"cut","params":{"label":"BILLIONS","icon":"chart","from":0,"to":5,"tone":"ok"},"vo":"Sealed Air was born. Billions in bubbles, from a wallpaper flop."},{"primitive":"end-card","transition":"ink-wipe","params":{"text":"*Send* it","sub":"To someone who pops every bubble."}}],"caption":"Bubble Wrap was failed wallpaper in 1957\n\nAlfred Fielding and Marc Chavannes sealed shower curtains and trapped air. It flopped twice, until IBM needed it for computers.\n\nSend this to whoever pops bubble wrap.\nSource: https://www.youtube.com/watch?v=7SKukIvI_WE","hashtags":["#history","#inventions","#backstory","#didyouknow"],"meta":{"source":"https://www.youtube.com/watch?v=7SKukIvI_WE","idea_id":"youtube-bubble-wrap-wallpaper","recipe_id":"c2-2026-w41-2","hero_metaphor":"the failed wallpaper","year":"1957","title_b":"They invented wallpaper. IBM made it billions."}}