{
  "format": "storyboard",
  "id": "c2-2026-w42-1",
  "channel": "c2-reach",
  "theme": "ink",
  "hookPattern": "number",
  "scenes": [
    {
      "primitive": "highlighter-swipe",
      "params": {
        "text": "Do small tasks in *one batch*, not all day."
      },
      "vo": "Do small tasks in *one batch*, not scattered across the whole day."
    },
    {
      "primitive": "conveyor",
      "transition": "ink-wipe",
      "params": {
        "item": {
          "title": "TASK",
          "id": "T-",
          "pill": "SMALL",
          "amount": false
        },
        "node": {
          "icon": "repeat",
          "label": "Same kind, once",
          "sub": "Grouped together"
        },
        "count": 12
      },
      "vo": "Replies, bills, calls. Group the same kind of task and run them together."
    },
    {
      "primitive": "split-flap",
      "transition": "whip-pan",
      "params": {
        "label": "BATCH WINDOW",
        "text": "4:00 PM",
        "sub": "One slot for every small task"
      },
      "vo": "*Pick* one slot in the day, like four in the afternoon."
    },
    {
      "primitive": "before-after-split",
      "transition": "whip-pan",
      "params": {
        "before": {
          "title": "SCATTERED",
          "lines": [
            "Reply, then switch",
            "Bill, then switch",
            "Call, then switch"
          ]
        },
        "after": {
          "title": "BATCHED",
          "lines": [
            "All replies at 4:00",
            "All bills at 4:20",
            "All calls at 4:40"
          ]
        }
      },
      "vo": "*Before*, every small task breaks your focus. *After*, they all wait for one slot."
    },
    {
      "primitive": "counter-drop",
      "transition": "whip-pan",
      "params": {
        "label": "SWITCHES",
        "icon": "refresh",
        "from": 30,
        "to": 3,
        "tone": "ok"
      },
      "vo": "Fewer switches. More time for the real work."
    },
    {
      "primitive": "end-card",
      "transition": "cut",
      "params": {
        "text": "*Follow*",
        "sub": "One smart idea, every day."
      },
      "vo": "Follow for one smart idea, every day."
    }
  ],
  "caption": "Do small tasks in one batch, not all day.\n\nGroup replies, bills and calls into one slot, like 4 PM, and the rest of the day stays free for deep work.\n\nExample data.\n\nFollow for one smart idea every day. Send this to the friend who answers every ping instantly.",
  "hashtags": [
    "#productivity",
    "#worksmarter",
    "#timemanagement"
  ],
  "meta": {
    "source": "https://trends.google.com/trends/explore?geo=IN&q=task%20batching",
    "idea_id": "idea-2026-10-02-batch-small-tasks",
    "recipe_id": "c2-2026-w42-1",
    "hero_metaphor": "one batch window"
  }
}
