{"format":"storyboard","id":"c2-2026-w41-3","channel":"c2-reach","theme":"archive-gold","style":"c2-archive-gold-v1","hookPattern":"question","scenes":[{"primitive":"counter-drop","params":{"label":"COPIES","icon":"chart","from":0,"to":700,"tone":"ok"},"vo":"Seven hundred thousand copies. VisiCalc sold the Apple II."},{"primitive":"pile-drop","transition":"cut","params":{"item":{"title":"SHEET","id":"S-","pill":"PAPER","amount":false},"count":20,"start":1},"vo":"Before 1979, changing one number meant recalculating every cell by hand."},{"primitive":"split-flap","transition":"cut","params":{"label":"*Dan Bricklin*","text":"*1979*","sub":"Watches a blackboard"},"vo":"Bricklin watched his professor erase and rewrite cells. He imagined a magic blackboard."},{"primitive":"maze-to-line","transition":"ink-wipe","params":{"from":"PAPER MAZE","to":"INSTANT MATH"},"vo":"Paper maze in, instant math out. Months of hard coding changed business forever."},{"primitive":"word-stack-slam","transition":"ink-wipe","params":{"text":"The *1979* killer app."},"vo":"VisiCalc. The killer app for business computing everywhere."},{"primitive":"end-card","transition":"ink-wipe","params":{"text":"*Follow*","sub":"More backstories every week."}}],"caption":"Dan Bricklin invented the spreadsheet in 1979\n\nHe watched his Harvard professor erase a blackboard model. VisiCalc let one change recalculate everything instantly.\n\nSend this to whoever lives in Excel.\nSource: https://www.youtube.com/watch?v=YDvbDiJZpy0","hashtags":["#history","#tech","#backstory","#didyouknow"],"meta":{"source":"https://www.youtube.com/watch?v=YDvbDiJZpy0","idea_id":"youtube-visicalc-bricklin","recipe_id":"c2-2026-w41-3","hero_metaphor":"the magic blackboard","year":"1979"}}