{
  "format": "storyboard",
  "id": "c1-2026-w41-4",
  "channel": "c1-automation",
  "theme": "night",
  "host": "chiku",
  "captionStyle": "karaoke",
  "hookPattern": "pile",
  "scenes": [
    {
      "primitive": "host-hook",
      "params": {
        "text": "Someone answered *all of these.*"
      },
      "vo": "Someone answered *all of these* by hand today. Every single one."
    },
    {
      "primitive": "ui-chat",
      "transition": "cut",
      "params": {
        "contact": "CUSTOMERS",
        "mode": "manual",
        "messages": [
          {
            "from": "them",
            "text": "Where is my order? PO-2231"
          },
          {
            "from": "them",
            "text": "Dispatched or not?"
          },
          {
            "from": "them",
            "text": "Send the LR copy please"
          },
          {
            "from": "me",
            "text": "Checking, will call you back"
          }
        ]
      },
      "vo": "*Where* is my order? *Dispatched* yet? *Send* the LR copy. Someone *checks* the dispatch sheet and replies to each customer."
    },
    {
      "primitive": "ui-inbox",
      "transition": "cut",
      "params": {
        "title": "DISPATCH@ INBOX",
        "mode": "manual",
        "rows": [
          {
            "from": "Kulkarni Motors",
            "subject": "Status of PO-2231?"
          },
          {
            "from": "Bhatia Textiles",
            "subject": "Need LR copy for 3 Oct dispatch"
          },
          {
            "from": "Naidu Pharma",
            "subject": "When will the truck reach?"
          }
        ]
      },
      "vo": "The inbox asks the same thing. *Kulkarni*, *Bhatia*, *Naidu*. All of them asking where their goods are right now."
    },
    {
      "primitive": "word-stack-slam",
      "transition": "whip-pan",
      "params": {
        "text": "Send the *update* first."
      },
      "vo": "Here is the *fix*. Send the update before they ask."
    },
    {
      "primitive": "conveyor",
      "transition": "cut",
      "params": {
        "item": {
          "title": "DISPATCH",
          "id": "LR-",
          "pill": "OUT",
          "amount": false
        },
        "node": {
          "icon": "whatsapp",
          "label": "Send update",
          "sub": "Truck no, LR, ETA"
        },
        "count": 10
      },
      "vo": "Each dispatch entry sends the customer their truck number, LR copy and expected arrival time."
    },
    {
      "primitive": "stamp-hit",
      "transition": "cut",
      "params": {
        "label": "UPDATED",
        "count": 3
      },
      "vo": "Updated, every customer, before they even ask."
    },
    {
      "primitive": "host-payoff",
      "transition": "whip-pan",
      "params": {
        "text": "Customers *stop asking.* You handle the delays."
      },
      "vo": "Customers *stop asking*. Your team only handles the late trucks, not every message."
    },
    {
      "primitive": "host-cta",
      "transition": "pixel-wipe",
      "params": {
        "text": "*Follow*",
        "sub": "One business automation, every day."
      },
      "vo": "Follow for one business automation, every day."
    }
  ],
  "caption": "Someone answered every where-is-my-order message by hand today.\n\nA small automation can send each customer the truck number, LR and expected arrival as soon as the dispatch is entered. Your team only handles the late trucks.\n\nExample data.\n\nFollow for one business automation every day. Send this to whoever handles dispatch.",
  "hashtags": [
    "#automation",
    "#smallbusinessindia",
    "#n8n",
    "#logistics"
  ],
  "meta": {
    "source": "https://trends.google.com/trends/explore?geo=IN&q=dispatch%20status",
    "idea_id": "idea-2026-10-02-dispatch-status",
    "recipe_id": "c1-2026-w41-4",
    "hero_metaphor": "question pile"
  }
}
