{
  "format": "storyboard",
  "id": "dispatch-lr",
  "channel": "c1-automation",
  "theme": "studio",
  "hookPattern": "question",
  "scenes": [
    {"primitive": "counter-drop", "params": {"label": "TO UPDATE", "icon": "truck", "from": 0, "to": 18, "tone": "alert"}, "vo": "Still *calling* the transporter?"},
    {"primitive": "conveyor", "params": {"item": {"title": "DISPATCH", "id": "LR-", "pill": "NEW", "amount": false}, "node": {"icon": "file", "label": "Copy LR number", "sub": "Transporter receipt"}, "count": 12}, "vo": "Every dispatch means copying the LR number and *messaging* each customer."},
    {"primitive": "word-stack-slam", "transition": "ink-wipe", "params": {"text": "The sheet *updates itself.*"}, "vo": "Here is the *fix.* One entry updates everything."},
    {"primitive": "flow-run", "transition": "whip-pan", "params": {"done": "SENT", "nodes": [
      {"icon": "file", "label": "Copy LR number", "sub": "Transporter receipt"},
      {"icon": "sheet", "label": "Log the dispatch", "sub": "Dispatch_Oct.xlsx"},
      {"icon": "whatsapp", "label": "Message customer", "sub": "Truck no, ETA"},
      {"icon": "check", "label": "Forward the POD", "sub": "Driver sends photo"}]}, "vo": "It *copies* the LR number, *logs* the dispatch, and *messages* the customer."},
    {"primitive": "chat-pop", "params": {"app": "WHATSAPP", "text": "Hi Sharma ji, your goods left today. Truck HR38 4521, ETA tomorrow 11 AM."}, "vo": "The customer gets the truck and ETA. Nobody *calls* again."},
    {"primitive": "end-card", "params": {"text": "*Follow*", "sub": "One dispatch automation, every day."}, "vo": "Follow for one dispatch automation every day."}
  ],
  "caption": "The truck left at 6 AM. The customer called at 11.\n\nA small automation can take one dispatch entry, update the sheet and send every customer their truck details.\n\nExample data.\n\nFollow for one business automation every day. Send this to whoever handles dispatch.",
  "hashtags": ["#automation", "#n8n", "#smallbusinessindia", "#logistics"],
  "meta": {"source": "https://example.com/ideas/dispatch-lr", "idea_id": "test-dispatch-lr", "recipe_id": "test-dispatch-lr"}
}
